{"baseLength":{"note":"Physical measurement required.","ranking":0,"sources":[],"unit":"mm","value":null},"classifiers":"Uncoupled rangefinder. Medium format folding camera with Apotar or Solinar lens.","createdAt":"2026-04-26","format":"6x6 on 120","id":"7f2a1b3c-0001-4e8d-9f0a-1b2c3d4e5f01","magnification":{"note":"Not documented.","ranking":0,"sources":[],"value":null},"manufacturer":"Agfa","model":"Isolette III","rfCoupling":"uncoupled","schemaVersion":1,"userAnnotation":null,"yearOfBuild":{"from":1952,"to":1960}}