{
  "schemaVersion": 1,
  "id": "7f2a1b3c-0001-4e8d-9f0a-1b2c3d4e5f01",
  "createdAt": "2026-04-26",
  "manufacturer": "Agfa",
  "model": "Isolette III",
  "classifiers": "Uncoupled rangefinder. Medium format folding camera with Apotar or Solinar lens.",
  "yearOfBuild": { "from": 1952, "to": 1960 },
  "rfCoupling": "uncoupled",
  "format": "6x6 on 120",
  "baseLength": {
    "value": null,
    "unit": "mm",
    "sources": [],
    "ranking": 0,
    "note": "Physical measurement required."
  },
  "magnification": {
    "value": null,
    "sources": [],
    "ranking": 0,
    "note": "Not documented."
  },
  "userAnnotation": null
}
